Rank,Title,Genre,Description,Director,Actors,Year,Runtime (Minutes),Rating,Votes,Revenue (Millions),Metascore
37,Interstellar,"Adventure,Drama,Sci-Fi",A team of explorers travel through a wormhole in space in an attempt to ensure humanity's survival.,Christopher Nolan,"Matthew McConaughey, Anne Hathaway, Jessica Chastain, Mackenzie Foy",2014,169,8.6,1047747,187.99,74.0
55,The Dark Knight,"Action,Crime,Drama","When the menace known as the Joker wreaks havoc and chaos on the people of Gotham, the Dark Knight must come to terms with one of the greatest psychological tests of his ability to fight injustice.",Christopher Nolan,"Christian Bale, Heath Ledger, Aaron Eckhart,Michael Caine",2008,152,9.0,1791916,533.32,82.0
81,Inception,"Action,Adventure,Sci-Fi","A thief, who steals corporate secrets through use of dream-sharing technology, is given the inverse task of planting an idea into the mind of a CEO.",Christopher Nolan,"Leonardo DiCaprio, Joseph Gordon-Levitt, Ellen Page, Ken Watanabe",2010,148,8.8,1583625,292.57,74.0
97,Kimi no na wa,"Animation,Drama,Fantasy","Two strangers find themselves linked in a bizarre way. When a connection forms, will distance be the only thing to keep them apart?",Makoto Shinkai,"Ryûnosuke Kamiki, Mone Kamishiraishi, Ryô Narita, Aoi Yuki",2016,106,8.6,34110,4.68,79.0
118,Dangal,"Action,Biography,Drama",Former wrestler Mahavir Singh Phogat and his two wrestler daughters struggle towards glory at the Commonwealth Games in the face of societal oppression.,Nitesh Tiwari,"Aamir Khan, Sakshi Tanwar, Fatima Sana Shaikh,Sanya Malhotra",2016,161,8.8,48969,11.15,
250,The Intouchables,"Biography,Comedy,Drama","After he becomes a quadriplegic from a paragliding accident, an aristocrat hires a young man from the projects to be his caregiver.",Olivier Nakache,"François Cluzet, Omar Sy, Anne Le Ny, Audrey Fleurot",2011,112,8.6,557965,13.18,57.0
